{
  "run_id": "20260801-181337-217cab5",
  "measured_at": "2026-08-01T20:10:27.146214+00:00",
  "source": {
    "instrument": "measure_metrics.py (Hermes engine state.db)",
    "state_db": "/home/lien/.hermes/state.db",
    "session_ids": [
      "20260801_181559_e95755",
      "20260801_181558_dd9947"
    ]
  },
  "session": {
    "model": "deepseek-v4-flash",
    "billing_provider": "deepseek",
    "wall_clock_seconds": 190.05,
    "input_tokens": 76383,
    "output_tokens": 21059,
    "cache_read_tokens": 965120,
    "cache_write_tokens": 0,
    "reasoning_tokens": 12259,
    "retry_count": 0,
    "estimated_cost_usd": 0.019292,
    "actual_cost_usd": 0.0,
    "cost_status": "estimated",
    "api_call_count": 29
  },
  "totals": {
    "input_tokens": 76383,
    "output_tokens": 21059,
    "cache_read_tokens": 965120,
    "retry_count": 0,
    "estimated_cost_usd": 0.019292,
    "wall_clock_seconds": 190.05
  },
  "phases": [
    {
      "phase": "ingest",
      "wall_clock_seconds": 0.0,
      "input_tokens": 0,
      "output_tokens": 0,
      "attribution": "engine records no per-message token_count; phase split unavailable, totals are session-level engine-recorded"
    },
    {
      "phase": "reproduce",
      "wall_clock_seconds": 205.56,
      "input_tokens": 0,
      "output_tokens": 0,
      "attribution": "engine records no per-message token_count; phase split unavailable, totals are session-level engine-recorded"
    },
    {
      "phase": "contract",
      "wall_clock_seconds": 411.33,
      "input_tokens": 0,
      "output_tokens": 0,
      "attribution": "engine records no per-message token_count; phase split unavailable, totals are session-level engine-recorded"
    },
    {
      "phase": "implement",
      "wall_clock_seconds": 0.0,
      "input_tokens": 0,
      "output_tokens": 0,
      "attribution": "engine records no per-message token_count; phase split unavailable, totals are session-level engine-recorded"
    },
    {
      "phase": "verify",
      "wall_clock_seconds": 525.98,
      "input_tokens": 0,
      "output_tokens": 0,
      "attribution": "engine records no per-message token_count; phase split unavailable, totals are session-level engine-recorded"
    },
    {
      "phase": "handoff",
      "wall_clock_seconds": 0.0,
      "input_tokens": 0,
      "output_tokens": 0,
      "attribution": "engine records no per-message token_count; phase split unavailable, totals are session-level engine-recorded"
    }
  ]
}